{
  "$schema": "http://json-schema.org/draft-07/schema#",
  "title": "Software Entry",
  "type": "object",
  "required": ["id", "name", "description", "url", "category", "os", "pricing"],
  "properties": {
    "id": { "type": "string", "pattern": "^[a-z0-9-]+$" },
    "name": { "type": "string" },
    "description": { "type": "string", "maxLength": 200 },
    "url": { "type": "string", "format": "uri" },
    "category": { "type": "string" },
    "os": {
      "type": "array",
      "items": { "type": "string", "enum": ["windows", "macos", "linux", "web", "ios", "android"] }
    },
    "pricing": { "type": "string", "enum": ["free", "freemium", "paid", "subscription"] },
    "tags": { "type": "array", "items": { "type": "string" } },
    "source": { "type": "string", "format": "uri" },
    "status": {
      "type": "string",
      "enum": ["idea", "in-progress", "submitted"],
      "description": "Forge lifecycle status: idea (unfulfilled request), in-progress (being built), submitted (built by forge). Absent for regular catalog entries."
    },
    "complexity": {
      "type": "string",
      "enum": ["weekend", "week", "month"],
      "description": "Estimated build complexity for forge ideas"
    },
    "capability": {
      "type": "string",
      "description": "Core capability this tool demonstrates (for forge entries)"
    },
    "approach": {
      "type": "string",
      "description": "Technical approach for building this tool (for forge entries)"
    },
    "projectPath": {
      "type": "string",
      "description": "Local path to the forge project directory"
    },
    "agentArchitecture": {
      "type": "object",
      "description": "Agent system used to build this tool",
      "properties": {
        "model": { "type": "string" },
        "roles": { "type": "array", "items": { "type": "string" } }
      }
    },
    "language": {
      "type": "string",
      "enum": ["python", "javascript", "typescript", "rust", "go", "c", "cpp", "java", "ruby", "php", "swift", "kotlin", "csharp", "dart", "elixir", "r", "julia", "lua", "zig", "haskell", "scala", "shell", "perl", "multi"]
    },
    "crucibleId": {
      "type": "string",
      "pattern": "^[a-z0-9-]+$",
      "description": "ID of the crucible entry this tool was built from (if applicable)"
    },
    "validation": {
      "type": "object",
      "description": "Evidence that the tool does what it claims (for crucible-originated entries)",
      "properties": {
        "benchmarks": {
          "type": "string",
          "description": "What was tested and results"
        },
        "limitations": {
          "type": "string",
          "description": "Known failure modes and boundaries"
        }
      }
    },
    "triage": {
      "type": "object",
      "description": "Forge triage scores. Required for ideas — the forge uses these to decide what to build next.",
      "required": ["impact", "buildability", "alternatives"],
      "properties": {
        "impact": {
          "type": "string",
          "enum": ["high", "medium", "low"],
          "description": "How helpful this tool would be to users"
        },
        "buildability": {
          "type": "string",
          "enum": ["straightforward", "moderate", "hard"],
          "description": "How feasible it is for AI agents to build"
        },
        "alternatives": {
          "type": "string",
          "enum": ["none", "partial", "covered"],
          "description": "Whether existing tools already fill this need: none = gap in the market, partial = tools exist but miss something important, covered = good tools already exist"
        },
        "alternatives_note": {
          "type": "string",
          "description": "Which existing tools cover this need and what gaps remain"
        }
      }
    }
  }
}
