[
  {
    "id": "pandas",
    "name": "pandas",
    "description": "Data analysis and manipulation library for Python. DataFrames, time series, and powerful I/O for CSV, SQL, Excel.",
    "url": "https://pandas.pydata.org",
    "category": "Data Analysis",
    "os": [
      "windows",
      "macos",
      "linux"
    ],
    "pricing": "free",
    "tags": [
      "python",
      "data-analysis",
      "dataframes",
      "open-source"
    ],
    "source": "https://github.com/pandas-dev/pandas",
    "language": "python"
  },
  {
    "id": "numpy",
    "name": "NumPy",
    "description": "Fundamental package for numerical computing in Python. N-dimensional arrays, linear algebra, and FFT.",
    "url": "https://numpy.org",
    "category": "Data Analysis",
    "os": [
      "windows",
      "macos",
      "linux"
    ],
    "pricing": "free",
    "tags": [
      "python",
      "numerical",
      "arrays",
      "open-source"
    ],
    "source": "https://github.com/numpy/numpy",
    "language": "python"
  },
  {
    "id": "polars",
    "name": "Polars",
    "description": "Blazing fast DataFrame library written in Rust with Python and Node.js bindings. Lazy evaluation and parallel execution.",
    "url": "https://pola.rs",
    "category": "Data Analysis",
    "os": [
      "windows",
      "macos",
      "linux"
    ],
    "pricing": "free",
    "tags": [
      "rust",
      "python",
      "dataframes",
      "fast",
      "open-source"
    ],
    "source": "https://github.com/pola-rs/polars",
    "language": "rust"
  },
  {
    "id": "jq",
    "name": "jq",
    "description": "Lightweight command-line JSON processor. Slice, filter, map, and transform structured data with a concise syntax.",
    "url": "https://jqlang.github.io/jq",
    "category": "Data Analysis",
    "os": [
      "windows",
      "macos",
      "linux"
    ],
    "pricing": "free",
    "tags": [
      "cli",
      "json",
      "data-processing",
      "open-source"
    ],
    "source": "https://github.com/jqlang/jq",
    "language": "c"
  },
  {
    "id": "duckdb",
    "name": "DuckDB",
    "description": "In-process analytical SQL database. Columnar storage, fast OLAP queries, and zero external dependencies.",
    "url": "https://duckdb.org",
    "category": "Data Analysis",
    "os": [
      "windows",
      "macos",
      "linux"
    ],
    "pricing": "free",
    "tags": [
      "sql",
      "olap",
      "columnar",
      "embedded",
      "open-source"
    ],
    "source": "https://github.com/duckdb/duckdb",
    "language": "cpp"
  },
  {
    "id": "apache-arrow",
    "name": "Apache Arrow",
    "description": "Cross-language columnar memory format for flat and hierarchical data. Zero-copy reads and fast analytics across systems.",
    "url": "https://arrow.apache.org",
    "category": "Data Analysis",
    "os": [
      "windows",
      "macos",
      "linux"
    ],
    "pricing": "free",
    "tags": [
      "columnar",
      "cross-language",
      "data-format",
      "analytics",
      "open-source"
    ],
    "source": "https://github.com/apache/arrow",
    "language": "cpp"
  },
  {
    "id": "datasette",
    "name": "Datasette",
    "description": "Instant JSON API and web interface for exploring and publishing SQLite databases. Great for data journalism and analysis.",
    "url": "https://datasette.io",
    "category": "Data Analysis",
    "os": [
      "windows",
      "macos",
      "linux"
    ],
    "pricing": "free",
    "tags": [
      "python",
      "sqlite",
      "data-exploration",
      "api",
      "open-source"
    ],
    "source": "https://github.com/simonw/datasette",
    "language": "python"
  },
  {
    "id": "apache-superset",
    "name": "Apache Superset",
    "description": "Modern data exploration and visualization platform. Create interactive dashboards with SQL queries and a rich chart library.",
    "url": "https://superset.apache.org",
    "category": "Data Analysis",
    "os": [
      "windows",
      "macos",
      "linux",
      "web"
    ],
    "pricing": "free",
    "tags": [
      "visualization",
      "dashboards",
      "sql",
      "business-intelligence",
      "open-source"
    ],
    "source": "https://github.com/apache/superset",
    "language": "python"
  },
  {
    "id": "metabase",
    "name": "Metabase",
    "description": "Open-source business intelligence tool. Ask questions about data with a visual query builder or SQL, and share dashboards.",
    "url": "https://www.metabase.com",
    "category": "Data Analysis",
    "os": [
      "windows",
      "macos",
      "linux",
      "web"
    ],
    "pricing": "freemium",
    "tags": [
      "business-intelligence",
      "dashboards",
      "sql",
      "visualization",
      "open-source"
    ],
    "source": "https://github.com/metabase/metabase",
    "language": "java"
  },
  {
    "id": "tableau",
    "name": "Tableau",
    "description": "Visual analytics platform for business intelligence. Drag-and-drop dashboards, data blending, and interactive charts.",
    "url": "https://www.tableau.com",
    "category": "Data Analysis",
    "os": [
      "windows",
      "macos",
      "web"
    ],
    "pricing": "paid",
    "tags": [
      "business-intelligence",
      "visualization",
      "dashboards",
      "analytics",
      "proprietary"
    ]
  },
  {
    "id": "power-bi",
    "name": "Power BI",
    "description": "Microsoft's business analytics service. Interactive visualizations, self-service BI, and integration with the Microsoft ecosystem.",
    "url": "https://powerbi.microsoft.com",
    "category": "Data Analysis",
    "os": [
      "windows",
      "web",
      "ios",
      "android"
    ],
    "pricing": "freemium",
    "tags": [
      "business-intelligence",
      "visualization",
      "microsoft",
      "dashboards",
      "proprietary"
    ]
  },
  {
    "id": "redash",
    "name": "Redash",
    "description": "Connect to any data source, query it, and visualize results. Share dashboards built from SQL queries across your team.",
    "url": "https://redash.io",
    "category": "Data Analysis",
    "os": [
      "windows",
      "macos",
      "linux",
      "web"
    ],
    "pricing": "freemium",
    "tags": [
      "sql",
      "dashboards",
      "visualization",
      "data-source",
      "open-source"
    ],
    "source": "https://github.com/getredash/redash",
    "language": "python"
  },
  {
    "id": "sqlalchemy",
    "name": "SQLAlchemy",
    "description": "Python SQL toolkit and ORM. Full power of SQL with flexible object-relational mapping and connection pooling.",
    "url": "https://www.sqlalchemy.org",
    "category": "ORMs",
    "os": [
      "windows",
      "macos",
      "linux"
    ],
    "pricing": "free",
    "tags": [
      "python",
      "sql",
      "orm",
      "database",
      "open-source"
    ],
    "source": "https://github.com/sqlalchemy/sqlalchemy",
    "language": "python"
  },
  {
    "id": "prisma",
    "name": "Prisma",
    "description": "Next-generation Node.js ORM with auto-generated types, migrations, and a visual database browser (Prisma Studio).",
    "url": "https://www.prisma.io",
    "category": "ORMs",
    "os": [
      "windows",
      "macos",
      "linux"
    ],
    "pricing": "free",
    "tags": [
      "typescript",
      "orm",
      "database",
      "migrations",
      "open-source"
    ],
    "source": "https://github.com/prisma/prisma",
    "language": "typescript"
  },
  {
    "id": "gorm",
    "name": "GORM",
    "description": "Full-featured ORM for Go. Auto migrations, associations, hooks, and support for MySQL, PostgreSQL, SQLite.",
    "url": "https://gorm.io",
    "category": "ORMs",
    "os": [
      "windows",
      "macos",
      "linux"
    ],
    "pricing": "free",
    "tags": [
      "go",
      "orm",
      "database",
      "sql",
      "open-source"
    ],
    "source": "https://github.com/go-gorm/gorm",
    "language": "go"
  },
  {
    "id": "sequelize",
    "name": "Sequelize",
    "description": "Promise-based Node.js ORM for PostgreSQL, MySQL, MariaDB, SQLite, and SQL Server. Migrations and eager loading.",
    "url": "https://sequelize.org",
    "category": "ORMs",
    "os": [
      "windows",
      "macos",
      "linux"
    ],
    "pricing": "free",
    "tags": [
      "javascript",
      "orm",
      "database",
      "nodejs",
      "open-source"
    ],
    "source": "https://github.com/sequelize/sequelize",
    "language": "javascript"
  },
  {
    "id": "typeorm",
    "name": "TypeORM",
    "description": "TypeScript ORM for Node.js supporting Active Record and Data Mapper patterns. Works with most SQL databases.",
    "url": "https://typeorm.io",
    "category": "ORMs",
    "os": [
      "windows",
      "macos",
      "linux"
    ],
    "pricing": "free",
    "tags": [
      "typescript",
      "orm",
      "database",
      "nodejs",
      "open-source"
    ],
    "source": "https://github.com/typeorm/typeorm",
    "language": "typescript"
  },
  {
    "id": "diesel",
    "name": "Diesel",
    "description": "Safe, extensible ORM and query builder for Rust. Compile-time checked queries and zero-cost abstractions.",
    "url": "https://diesel.rs",
    "category": "ORMs",
    "os": [
      "windows",
      "macos",
      "linux"
    ],
    "pricing": "free",
    "tags": [
      "rust",
      "orm",
      "database",
      "type-safe",
      "open-source"
    ],
    "source": "https://github.com/diesel-rs/diesel",
    "language": "rust"
  },
  {
    "id": "drizzle-orm",
    "name": "Drizzle ORM",
    "description": "Lightweight TypeScript ORM with a SQL-like query builder. Serverless-ready with zero dependencies and type safety.",
    "url": "https://orm.drizzle.team",
    "category": "ORMs",
    "os": [
      "windows",
      "macos",
      "linux"
    ],
    "pricing": "free",
    "tags": [
      "typescript",
      "orm",
      "serverless",
      "type-safe",
      "open-source"
    ],